{
  "$schema": "https://json-schema.org/draft/2020-12/schema",
  "title": "market-ticks topic schema (v1)",
  "type": "object",
  "required": ["schemaVersion", "event_type", "agent_name", "git_sha", "ts", "trace_id", "payload"],
  "properties": {
    "schemaVersion": { "const": 1 },
    "event_type": { "type": "string", "minLength": 1 },
    "agent_name": { "type": "string", "minLength": 1 },
    "git_sha": { "type": "string", "minLength": 1 },
    "ts": { "type": "string", "minLength": 1 },
    "trace_id": { "type": "string", "minLength": 1 },
    "payload": {
      "type": "object",
      "required": ["symbol"],
      "properties": {
        "symbol": { "type": "string", "minLength": 1 },
        "ts": { "type": "string" },
        "observedAt": { "type": "string" },
        "bid": { "type": "number" },
        "ask": { "type": "number" },
        "last": { "type": "number" },
        "bidSize": { "type": "number" },
        "askSize": { "type": "number" },
        "lastSize": { "type": "number" }
      },
      "additionalProperties": true
    }
  },
  "additionalProperties": true
}
