{
  "schemaVersion": 1,
  "event_type": "trade.signal",
  "agent_name": "pytest",
  "git_sha": "deadbeef",
  "ts": "2026-01-08T00:00:00Z",
  "trace_id": "trace123",
  "payload": {
    "symbol": "AAPL",
    "action": "BUY",
    "signalType": "entry",
    "strategyId": "s1",
    "reason": "fixture",
    "notional_usd": 1000
  }
}
